{
  "schema_version": "1.0.0",
  "audit_date": "2026-09-21",
  "skill_version": "1.3.0",
  "observed_hermes_release": "v0.21.3",
  "observed_hermes_tag": "v2026.9.14",
  "sources_checked": ["releases","features-overview","profiles","profile-distributions","bot-mode","skills","context-files","memory","memory-providers","honcho","delegation","kanban","kanban-worker-lanes","tools","tools-reference","code-execution","mcp","cron","security","checkpoints","models","fallback-providers","provider-routing","observer-hooks","plugins"],
  "change_event_ids": [],
  "highest_severity": "info",
  "capability_results": [
    {"id":"profiles","status":"verified","verified_on":"2026-09-21"},
    {"id":"bot_mode","status":"verified","verified_on":"2026-09-21"},
    {"id":"delegation","status":"verified","verified_on":"2026-09-21"},
    {"id":"structured_output","status":"verified","verified_on":"2026-09-21"},
    {"id":"kanban","status":"verified","verified_on":"2026-09-21"},
    {"id":"skills_context_soul","status":"verified","verified_on":"2026-09-21"},
    {"id":"memory","status":"verified","verified_on":"2026-09-21"},
    {"id":"tools_mcp","status":"verified","verified_on":"2026-09-21"},
    {"id":"execute_code","status":"verified","verified_on":"2026-09-21"},
    {"id":"model_routing","status":"verified","verified_on":"2026-09-21"},
    {"id":"cron","status":"verified","verified_on":"2026-09-21"},
    {"id":"security","status":"verified","verified_on":"2026-09-21"},
    {"id":"observability","status":"verified","verified_on":"2026-09-21"}
  ],
  "validation": {
    "structural":"passed",
    "architecture":"passed",
    "release_impact":"passed",
    "health_drift":"passed"
  },
  "notes":["Initial historical audit snapshot seeded from the verified v1.0-v1.2 research baseline."]
}
